{
  "$schema": "https://json-schema.org/draft/2020-12/schema",
  "$id": "derived-record.schema.json",
  "title": "Derived record of one innovation (prompt extract-v1)",
  "description": "What an extraction worker writes to .local/pipeline/derived/<id>.json. Closed lists (target_groups, domains, implementer_types, setting, scale, cost_band, time_to_implement, evidence_level) are enforced by scripts/derive-records.py from data/curated/taxonomies.json, the single source of truth; word limits, grounding and personal-data rules are enforced there too. See docs/innovation-record.md.",
  "type": "object",
  "additionalProperties": false,
  "required": [
    "id", "prompt_version", "generated_by", "generated_at", "source_fingerprint",
    "summary_pl", "problem_pl", "mechanism_pl", "index_card_pl",
    "target_groups", "domains", "implementer_types",
    "setting", "scale", "cost_band", "time_to_implement", "evidence_level",
    "origin_place_pl", "requires_pl", "keywords_pl", "evidence", "confidence", "notes_pl"
  ],
  "properties": {
    "id": {"type": "string", "pattern": "^inn-(nat|rops|partner)-[a-z0-9-]+$"},
    "prompt_version": {"type": "string", "pattern": "^extract-v[0-9]+$"},
    "generated_by": {"type": "string", "minLength": 3, "description": "Model id of the worker, as given by the coordinator, e.g. claude-haiku-4-5"},
    "generated_at": {"type": "string", "pattern": "^[0-9]{4}-[0-9]{2}-[0-9]{2}$"},
    "source_fingerprint": {"type": "string", "pattern": "^[0-9a-f]{16}$", "description": "Copied from the source record's 'fingerprint'; a mismatch marks the derived record stale"},
    "summary_pl": {"type": "string", "minLength": 20, "description": "What it is, for whom, how; at most 60 words"},
    "problem_pl": {"type": "string", "minLength": 10, "description": "The problem it answers; at most 60 words"},
    "mechanism_pl": {"type": "string", "minLength": 10, "description": "How it works, concretely; at most 60 words"},
    "index_card_pl": {"type": "string", "minLength": 10, "description": "One line for the matching index; at most 30 words"},
    "target_groups": {"type": "array", "minItems": 1, "maxItems": 3, "uniqueItems": true, "items": {"type": "string"}},
    "domains": {"type": "array", "minItems": 1, "maxItems": 3, "uniqueItems": true, "items": {"type": "string"}},
    "implementer_types": {"type": "array", "minItems": 1, "maxItems": 5, "uniqueItems": true, "items": {"type": "string"}},
    "setting": {"type": "string"},
    "scale": {"type": "string"},
    "cost_band": {"type": "string"},
    "time_to_implement": {"type": "string"},
    "evidence_level": {"type": "string"},
    "origin_place_pl": {"type": ["string", "null"], "description": "A town or gmina named in the source, copied verbatim; null when the source names none"},
    "requires_pl": {"type": "array", "minItems": 1, "maxItems": 6, "items": {"type": "string", "minLength": 3}},
    "keywords_pl": {"type": "array", "minItems": 3, "maxItems": 10, "uniqueItems": true, "items": {"type": "string", "minLength": 2}},
    "evidence": {
      "type": "object",
      "additionalProperties": false,
      "required": ["cost_band", "time_to_implement", "evidence_level", "setting", "scale"],
      "properties": {
        "problem_pl": {"$ref": "#/$defs/evidence_item", "description": "Anchoring quote of the problem paragraph; required from extract-v2 on"},
        "mechanism_pl": {"$ref": "#/$defs/evidence_item", "description": "Anchoring quote of the mechanism paragraph; required from extract-v2 on"},
        "cost_band": {"$ref": "#/$defs/evidence_item"},
        "time_to_implement": {"$ref": "#/$defs/evidence_item"},
        "evidence_level": {"$ref": "#/$defs/evidence_item"},
        "setting": {"$ref": "#/$defs/evidence_item"},
        "scale": {"$ref": "#/$defs/evidence_item"}
      }
    },
    "confidence": {"type": "string", "enum": ["high", "medium", "low"]},
    "notes_pl": {"type": ["string", "null"], "description": "Doubts for the reviewer; at most 40 words; null when none"}
  },
  "$defs": {
    "evidence_item": {
      "type": "object",
      "additionalProperties": false,
      "required": ["basis", "quote"],
      "properties": {
        "basis": {"type": "string", "enum": ["quote", "inference", "unknown"], "description": "quote: the source states it (quote required); inference: judged from what the source describes; unknown: the source gives nothing"},
        "quote": {"type": ["string", "null"], "maxLength": 300, "description": "Verbatim words from the source record's text_pl, at most 20 words; required when basis is quote"}
      }
    }
  }
}
